id,published,published_date,title,url,source,summary,relevance_hits,article_keywords,article_excerpt
CBMiqwFBVV95cUxQSldmcGZFZ3ZrZC1xZlplRUlELTV2Uks3Y1RiNWN2VXJreEtsTlJKdkg5ZVM3MURwTndoREtCTWZTcm5HcTI1TDViYXRMZlVMMDNSbW5tbkhEUllWNWhKTzF6eDFLelJUYlhMZ3ZkamQ2eXBmckxmX3hUZGthRFdzVlU0N0lMMVN4RjFwWDJoUlU1XzZFcTR4eER2b2RnazBzX25ZRV9sRk9sV00,"Fri, 20 Feb 2026 08:00:00 GMT",2026-02-20,"The Department for Education needs a plumber, better policymakers, less panic, and someone who truly understands SEND - Special Needs Jungle",https://www.specialneedsjungle.com/dfe-needs-plumber-better-policymakers-less-panic-truly-understands-send/,news.google.com,"The Department for Education needs a plumber, better policymakers, less panic, and someone who truly understands SEND
Someone, clearly, was not prepared to wait for Monday’s expected reveal of the Schools White Paper, with its feared SEND section in whatever form that will be. Yesterday, The Times leaked Government proposals for changing special educational needs support that supposedly make up part of the Schools White Paper. These proposals have been roundly condemned by campaigners and some charities–unless you happen to be one of those in the Government’s inner circle, either by funding or ambition.","{""education_terms"": [""education"", ""school"", ""schools"", ""pupil"", ""pupils"", ""teacher"", ""teachers"", ""gcse"", ""department for education"", ""dfe""], ""inclusion_terms"": [""inclusion"", ""equity"", ""special educational needs"", ""send"", ""sen"", ""ehcp"", ""disabled"", ""adhd"", ""accessible""]}","[""send"", ""special"", ""share"", ""needs"", ""children"", ""opens"", ""window"", ""paper"", ""government"", ""your"", ""march"", ""schools"", ""white"", ""proposals"", ""families"", ""here"", ""jungle"", ""education"", ""rights"", ""support""]","The Department for Education needs a plumber, better policymakers, less panic, and someone who truly understands SEND
Someone, clearly, was not prepared to wait for Monday’s expected reveal of the Schools White Paper, with its feared SEND section in whatever form that will be.
Yesterday, The Times leaked Government proposals for changing special educational needs support that supposedly make up part of the Schools White Paper. These proposals have been roundly condemned by campaigners and some charities–unless you happen to be one of those in the Government’s inner circle, either by funding or ambition. And of course, silence from local authorities, who seem to be getting off pretty much free of responsibilities. What’s most striking about these leaks is not just the content, but the manner of their arrival. Families have spent months in limbo, waiting for clarity about reforms that will shape their children’s futures. To have key elements drip‑fed through anonymous briefings is yet another reminder of how little regard is shown for the people most affected. Disabled children should never be the subject of policy‑by‑leak.
This article is not going to look in depth at the leaked pro"
CBMiWkFVX3lxTE1lSWdDbDFsLVRkSVhtckFyUHpXbzdRYlhwakIzQlY2d19PUy1zdXdWaFlsT1poeEVVWlNFMjZhU1poTjYweWtxNWd5QS1fR05SS0dCWVdDV0dLQQ,"Fri, 20 Feb 2026 08:00:00 GMT",2026-02-20,Plans submitted for delayed SEND school to be built in Hull - BBC,https://www.bbc.com/news/articles/ckg1nnp9r4eo,news.google.com,Plans for a school for students with special educational needs and disabilities (SEND) have been submitted by a council. The Willowfield SEND Free School would have space for 125 pupils on a site east of the existing Frederick Holmes School on Inglemire Lane in Hull. The planned school was first announced in 2019 with an allocated budget of £19.6m but it has been hit by a series of delays.,"{""education_terms"": [""education"", ""school"", ""pupil"", ""pupils"", ""student"", ""students"", ""classroom"", ""department for education""], ""inclusion_terms"": [""special educational needs"", ""send"", ""sen"", ""accessible""]}","[""school"", ""council"", ""education"", ""send"", ""hull"", ""plans"", ""site"", ""east"", ""frederick"", ""holmes"", ""inglemire"", ""lane"", ""city"", ""authority"", ""department"", ""construction"", ""work"", ""facility"", ""spaces"", ""play""]","Plans for a school for students with special educational needs and disabilities (SEND) have been submitted by a council.
The Willowfield SEND Free School would have space for 125 pupils on a site east of the existing Frederick Holmes School on Inglemire Lane in Hull.
The planned school was first announced in 2019 with an allocated budget of £19.6m but it has been hit by a series of delays.
Councillor Linda Tock, of Hull City Council, said: ""This is an exciting project that would go some way to providing much‑needed additional SEND provision in the city.""
The authority previously said costs had risen to £25.6m and the £6m shortfall would be split equally by council funding and the Department for Education.
Construction work was due to start at the site on Inglemire Lane in 2025, with an expected completion date of November 2026.
If plans are approved, the facility would provide education for learners aged four to 19 with severe physical and learning difficulties.
The new facility would include a mixture of classrooms, specialist teaching and therapy spaces, and a hydrotherapy pool.
There would also be new hard and soft play areas and accessible parking spaces.
The council said both "
CBMilAFBVV95cUxQVEYtWWNXZ0Q1UC1ZU3IzVnd6eDduSnVUTUJPYkctc21vVEJWSGg5RVkwcldpbmtoc2lIWDZBMS1ZWUVHeGVsTklzRWZEeXZQZC04a0xxRDVfWm5IcHU1Z0RsdEEwbzZIMDhZR3Q4S2JISGZwVmdyaHJSMnEyR0ZveWhGY1U2TWJyY0ZKTG5UY1BOZ3p2,"Thu, 19 Feb 2026 08:00:00 GMT",2026-02-19,Government ends runaway independent special school fees - GOV.UK,https://www.gov.uk/government/news/government-ends-runaway-independent-special-school-fees,news.google.com,"Government ends runaway independent special school fees
Children’s progress put first as government ends runaway independent special school fees
Thousands more children with SEND will get the support that helps them achieve and thrive under new government action to end spiralling independent special school costs and reinvest funding where it makes the biggest difference to pupils’ life chances. It comes ahead of the Government’s schools white paper, which will be a golden opportunity to change the course of children’s lives for the better, moving away from a one size fits all approach to one where every child belongs and where high standards and inclusion are two sides of the same coin.","{""education_terms"": [""education"", ""school"", ""schools"", ""pupil"", ""pupils"", ""teacher"", ""teachers"", ""gcse"", ""exam""], ""inclusion_terms"": [""inclusion"", ""inclusive"", ""equity"", ""send"", ""sen"", ""ehcp""]}","[""children"", ""schools"", ""special"", ""independent"", ""support"", ""school"", ""send"", ""government"", ""high"", ""every"", ""child"", ""ensure"", ""delivers"", ""mainstream"", ""thrive"", ""pupils"", ""better"", ""standards"", ""most"", ""quality""]","Government ends runaway independent special school fees
Children’s progress put first as government ends runaway independent special school fees
Thousands more children with SEND will get the support that helps them achieve and thrive under new government action to end spiralling independent special school costs and reinvest funding where it makes the biggest difference to pupils’ life chances.
It comes ahead of the Government’s schools white paper, which will be a golden opportunity to change the course of children’s lives for the better, moving away from a one size fits all approach to one where every child belongs and where high standards and inclusion are two sides of the same coin.
Independent special schools charge an average of £63,000 per child per year – more than twice the £26,000 cost of a state special school. Yet there is no evidence children do any better. Over 30% of these schools are backed by private equity firms, with public money intended for children and young people with the most complex needs instead flowing into private profit.
For the first time, clear national price bands and strengthened standards will ensure every specialist placement delivers real progre"
CBMiWkFVX3lxTFBkNjhsckJQY0VZUW1vbWJiVEZmVTdxeVhSQ0VjeC02VTRyVm1mMmtqNDhaMDBrZUlZU01keUdvMTE3RVlzRW13QXhIT2U5R2VKOEZjaE1xbFptUQ,"Thu, 19 Feb 2026 08:00:00 GMT",2026-02-19,"Pupils with SEND to have support reviewed after primary, leaked plans suggest - BBC",https://www.bbc.com/news/articles/cx2d041wl6po,news.google.com,"Children with special educational needs and disabilities (SEND) in England will have their right to support reviewed as they move into secondary school, leaked government plans suggest. Children with education, health and care plans (EHCPs), legal documents setting out what extra support they are entitled to, will be reassessed after primary school from 2029 as part of a wider system overhaul. The BBC understands this will sit alongside an extension of legal rights to include all children with SEND through school-led Individual Support Plans (ISP).","{""education_terms"": [""education"", ""school"", ""schools"", ""pupil"", ""pupils"", ""student"", ""students"", ""teacher"", ""teachers"", ""college"", ""department for education""], ""inclusion_terms"": [""inclusion"", ""inclusive"", ""special educational needs"", ""send"", ""sen"", ""ehcp"", ""disability"", ""autism""]}","[""children"", ""plans"", ""needs"", ""support"", ""school"", ""send"", ""education"", ""system"", ""government"", ""legal"", ""rights"", ""schools"", ""ehcp"", ""secondary"", ""leaked"", ""individual"", ""national"", ""parents"", ""complex"", ""england""]","Children with special educational needs and disabilities (SEND) in England will have their right to support reviewed as they move into secondary school, leaked government plans suggest.
Children with education, health and care plans (EHCPs), legal documents setting out what extra support they are entitled to, will be reassessed after primary school from 2029 as part of a wider system overhaul.
The BBC understands this will sit alongside an extension of legal rights to include all children with SEND through school-led Individual Support Plans (ISP).
Paul Whiteman, the general secretary of the National Association of Headteachers, told the BBC ""the current system fails children and fails schools"".
The radical plans could be unveiled in full as early as Monday, when MPs return to Parliament.
A Department for Education spokesperson said ministers would set out their full plans ""shortly"" in a new Schools White Paper, which they said would provide ""an expansion of children's rights"" and build on the work being done to create a ""truly inclusive system"".
The Liberal Democrats have said the system needs a ""radical shake-up, not minor adjustments"".
""Tweaking spreadsheets won't fix a system t"
CBMi1gFBVV95cUxNZXhNdWgzOXpVS1RlaHpEdmkxZHB6eWQybWhKc3JBUmxYMTB1WEw5LWdCcUZxTkZsTzByNGZCZVZTRXByd19idzdKNEdHSHBfcHV1cUk5TEV0cElVVXF4TUVtQW9PS3lnLUI4azM2QlU0MEM0S01vQ3RBUm1MWlh6c1FvUWhqelJOX0lBMVRKcnpVQk15Y2l1eloxb1hzaFdsYUNPSVVmVzFJcmpXd1IwMnFNYXF3bEx3RDdvenh5eDFocGhJXzFrOTlOdU82YmxHQ1dpWHB3,"Thu, 19 Feb 2026 08:00:00 GMT",2026-02-19,Schools in England to get budget for children with special needs as part of Send overhaul - The Guardian,https://www.theguardian.com/education/2026/feb/19/schools-in-england-to-get-budget-for-children-with-special-needs-as-part-of-send-overhaul,news.google.com,"Schools in England to get budget for children with special needs as part of Send overhaul
Children to get individual support directly from school instead of via council in attempt to curb spiralling costs
Children in England with special needs will receive individual support and therapy directly from their schools as part of the government’s overhaul of England’s special education provision. Under the plans, mainstream schools will be given commissioning budgets to spend on therapists or additional support, instead of the money being controlled by highly indebted local authorities.","{""education_terms"": [""education"", ""school"", ""schools"", ""pupil"", ""pupils""], ""inclusion_terms"": [""special educational needs"", ""send"", ""sen"", ""ehcp"", ""disabled"", ""autism"", ""adhd"", ""reasonable adjustments""]}","[""children"", ""schools"", ""special"", ""support"", ""needs"", ""plans"", ""make"", ""ehcps"", ""school"", ""government"", ""mainstream"", ""england"", ""part"", ""individual"", ""provision"", ""system"", ""legal"", ""reforms"", ""available"", ""send""]","Schools in England to get budget for children with special needs as part of Send overhaul
Children to get individual support directly from school instead of via council in attempt to curb spiralling costs
Children in England with special needs will receive individual support and therapy directly from their schools as part of the government’s overhaul of England’s special education provision.
Under the plans, mainstream schools will be given commissioning budgets to spend on therapists or additional support, instead of the money being controlled by highly indebted local authorities.
The plans are part of a package of sweeping changes to special educational needs and disabilities (Send) provision that will be announced by the education secretary, Bridget Phillipson, on Monday.
The measures are aimed at fixing deep-rooted problems with the Send system and curbing spiralling costs that have brought several councils to the brink of bankruptcy . Critics of the current system say lopsided funding mechanisms leave hundreds of thousands of children with little or no support in mainstream schools, requiring their families to battle local authorities for help.
But government officials are con"
CBMivAFBVV95cUxNOFMtMDlMcjhmMDVGYWJnZ1NIWnZlY05wYU02a0RneXpfZGNUajBCSXRkQVpmQzFMZlVzdnh1QXR4aUZaR2xSOThZWkJSdjZEblVCbzRRVS1haFcyRUMwWm9iT3d0dTItYkdQRzkwSFVCZWtOLWtQQk5aZldkTW1VQUNScHlBWGc1SldrMkN2eVFmR05UT3Z0YmJEMzJNbnJUN0ltbUZDbHNOOV9XbWk4U3hQSkFFVHFHN0VXNw,"Thu, 19 Feb 2026 08:00:00 GMT",2026-02-19,Special needs support eligibility to be reviewed at start of secondary school in England - The Guardian,https://www.theguardian.com/education/2026/feb/19/send-special-needs-support-eligibility-review-secondary-school-england,news.google.com,"Special needs support eligibility to be reviewed at start of secondary school in England
First cohort to be affected by change – part of Send system overhaul – are currently in key stage 1, it is understood
Children with a legal right to special needs support will face a review when they move to secondary school, with the first cohort to be affected currently in key stage 1, the Guardian understands. A total overhaul of the special educational needs and disabilities (Send) system is due to be unveiled on Monday in a schools white paper that could face major opposition from Labour MPs.","{""education_terms"": [""education"", ""school"", ""schools"", ""pupil"", ""pupils"", ""teacher"", ""teachers"", ""department for education""], ""inclusion_terms"": [""inclusive"", ""special educational needs"", ""send"", ""sen"", ""ehcp"", ""autism"", ""adhd""]}","[""needs"", ""children"", ""support"", ""system"", ""special"", ""send"", ""schools"", ""school"", ""plans"", ""currently"", ""legal"", ""labour"", ""changes"", ""year"", ""local"", ""overhaul"", ""ehcp"", ""government"", ""source"", ""already""]","Special needs support eligibility to be reviewed at start of secondary school in England
First cohort to be affected by change – part of Send system overhaul – are currently in key stage 1, it is understood
Children with a legal right to special needs support will face a review when they move to secondary school, with the first cohort to be affected currently in key stage 1, the Guardian understands.
A total overhaul of the special educational needs and disabilities (Send) system is due to be unveiled on Monday in a schools white paper that could face major opposition from Labour MPs.
The changes will raise the bar at which children in England qualify for an education, health and care plan (EHCP), which legally entitles children with Send to get support. EHCPs will be reserved for children with the most severe and complex needs, but new plans for children on lower tiers will still confer additional support and legal rights.
Parents would have legal avenues for appeals under existing equalities legislation and through the tribunal, said sources with knowledge of the proposed new system.
The Send system overhaul is seen as the most high-stakes policy change the government has taken o"
CBMisAFBVV95cUxQLXVyNG10akFzLU1SekNWbnVER0hZaUZ5ekpnMDcza0pBYURXSDIxNWtGTVRIeWVFcVYzQzcwVzhPY05JZjlkRDNiUFZGUjFDdDA2SlBUX0l1NHJXSmVyTzNGWmtXeVZ1VXI0SEpORldWMUR4Y2hIVG5OeDFSYmJselFycHZPaDBBazdrM28tS2FHRHRMaGhIZTR6TUlvVldmOWlOa0JtRFhTNnl1TFlRRw,"Thu, 19 Feb 2026 08:00:00 GMT",2026-02-19,Councils in England call for ‘radical’ means testing of Send school transport - The Guardian,https://www.theguardian.com/education/2026/feb/19/councils-england-urge-means-testing-for-send-school-transport,news.google.com,"Councils in England call for ‘radical’ means testing of Send school transport
Demand is rising at unsustainable rate and could cost £3.4bn by 2030-31, local authorities warn
Families who have children with special educational needs and disabilities (Send) should be means tested for school transport, according to councils in England , who say demand is rising “at an unsustainable rate”. Local authorities are urging the government to be “radical” in its Send reforms, which are expected imminently, warning that annual costs on home-to-school transport for children with Send could rise to £3.4bn by 2030-31, up from £2bn last year.","{""education_terms"": [""education"", ""school"", ""schools"", ""pupil"", ""pupils"", ""department for education""], ""inclusion_terms"": [""inclusive"", ""special educational needs"", ""send"", ""sen"", ""disabled""]}","[""school"", ""transport"", ""send"", ""children"", ""local"", ""authorities"", ""needs"", ""young"", ""people"", ""councils"", ""means"", ""home"", ""disabled"", ""education"", ""testing"", ""special"", ""government"", ""england"", ""demand"", ""rising""]","Councils in England call for ‘radical’ means testing of Send school transport
Demand is rising at unsustainable rate and could cost £3.4bn by 2030-31, local authorities warn
Families who have children with special educational needs and disabilities (Send) should be means tested for school transport, according to councils in England , who say demand is rising “at an unsustainable rate”.
Local authorities are urging the government to be “radical” in its Send reforms, which are expected imminently, warning that annual costs on home-to-school transport for children with Send could rise to £3.4bn by 2030-31, up from £2bn last year.
The County Councils Network (CCN) said its analysis showed that without significant system reform local authorities would be transporting 100,000 additional pupils – “a city’s worth of young people” – to school by the end of the decade.
It is calling on the government to introduce a national means-testing policy so families above a specified income threshold would be required to make a financial contribution to home-to-school transport. “This would need to be implemented sensitively and progressively, bearing in mind the current cost of living crisis,” the CC"
CBMixAFBVV95cUxQT2E4UWV6enZoaEhoS21ycDZRZ1JDNjZnSC0zQ3lLSmZWdGJsZ3hTSGY5YVZJckx5Zk04R3lfdUxKX0ZLQS05REpyYVh1d25XTHlMNTladnNLQlcyUGVfX0s1cHVWeW42azV1Yy1neE1sS3FjSkJhQVR4Sy1wZ2dpSTdETk9IZ1AwaWhlNHpFVW9RWlVFZDV2TDVxXzlnZkVaTkN6RGNURE9BSzZzQUhKU1ZSZlhSbmc1TWluZTMzbVZlRjlq,"Thu, 19 Feb 2026 08:00:00 GMT",2026-02-19,SEND families braced for government's education white paper - The Law Society Gazette,https://www.lawgazette.co.uk/commentary-and-opinion/send-families-braced-for-governments-education-white-paper/5125939.article,news.google.com,Please click here to read about how we process your data in compliance with the General Data Protection Regulation (GDPR).,"{""education_terms"": [""education"", ""school"", ""schools"", ""pupil"", ""pupils"", ""teacher"", ""teachers"", ""classroom"", ""department for education"", ""dfe""], ""inclusion_terms"": [""inclusion"", ""special educational needs"", ""send"", ""sen"", ""ehcp"", ""disability"", ""autism"", ""adhd"", ""suspension""]}","[""legal"", ""send"", ""government"", ""parent"", ""navigation"", ""back"", ""item"", ""tribunal"", ""support"", ""education"", ""paper"", ""people"", ""ehcps"", ""opinion"", ""practice"", ""lawyers"", ""white"", ""needs"", ""being"", ""schools""]","Our Privacy Policy has changed. Please click here to read about how we process your data in compliance with the General Data Protection Regulation (GDPR).
Home Back to parent navigation item Home Magazine
Back to parent navigation item
News Back to parent navigation item News Recent headlines Obiter Brexit
Back to parent navigation item
Analysis Back to parent navigation item Analysis Features Commentary and opinion Wellbeing Feedback Reviews Insights Travel
Back to parent navigation item
Law Back to parent navigation item Law Personal injury Private client Property Risk and compliance Law reports Legal updates Litigation funding Practice points
Back to parent navigation item
Practice Back to parent navigation item Practice SDT and SRA interventions Practice management Travel
Back to parent navigation item
SDT and SRA interventions
People Back to parent navigation item People Profiles Roundtables Women in the Law Lawyer in the news My legal life Movers Deceased
Back to parent navigation item
Directories Back to parent navigation item Directories Legal Services Directory Charity Explorer Back to parent navigation item Charity Explorer Animals and Birds Arts, culture & sport Children"
CBMiXEFVX3lxTE56bnllMUhoMnNGU2dvRkVaamU5QVNoTDZFWUFQMEVUVFcwS2FwVGJmRXlsbmV2U1BSY29VM3RLMndYWGtmUW5HdnczTzZCb1JNTHUwVXBLVmlUMlkz,"Thu, 19 Feb 2026 08:00:00 GMT",2026-02-19,"Pupils with SEND to have support reviewed after primary, leaked plans suggest - BBC",https://www.bbc.co.uk/news/articles/cx2d041wl6po,news.google.com,"Pupils with SEND to have support reviewed after primary, leaked plans suggest
Published 19 February 2026
Children with special educational needs and disabilities (SEND) in England will have their right to support reviewed as they move into secondary school, leaked government plans suggest. Children with education, health and care plans (EHCPs), legal documents setting out what extra support they are entitled to, will be reassessed after primary school from 2029 as part of a wider system overhaul. The BBC understands this will sit alongside an extension of legal rights to include all children with SEND through school-led Individual Support Plans (ISP).","{""education_terms"": [""education"", ""school"", ""schools"", ""pupil"", ""pupils"", ""student"", ""students"", ""teacher"", ""teachers"", ""college"", ""department for education""], ""inclusion_terms"": [""inclusion"", ""inclusive"", ""special educational needs"", ""send"", ""sen"", ""ehcp"", ""disability"", ""autism""]}","[""children"", ""send"", ""plans"", ""school"", ""support"", ""needs"", ""education"", ""system"", ""government"", ""legal"", ""rights"", ""leaked"", ""schools"", ""reforms"", ""ehcp"", ""primary"", ""published"", ""secondary"", ""individual"", ""national""]","Pupils with SEND to have support reviewed after primary, leaked plans suggest
Published 19 February 2026
Children with special educational needs and disabilities (SEND) in England will have their right to support reviewed as they move into secondary school, leaked government plans suggest.
Children with education, health and care plans (EHCPs), legal documents setting out what extra support they are entitled to, will be reassessed after primary school from 2029 as part of a wider system overhaul.
The BBC understands this will sit alongside an extension of legal rights to include all children with SEND through school-led Individual Support Plans (ISP).
Paul Whiteman, the general secretary of the National Association of Headteachers, told the BBC ""the current system fails children and fails schools"".
The radical plans could be unveiled in full as early as Monday, when MPs return to Parliament.
A Department for Education spokesperson said ministers would set out their full plans ""shortly"" in a new Schools White Paper, which they said would provide ""an expansion of children's rights"" and build on the work being done to create a ""truly inclusive system"".
The Liberal Democrats have said "
