id,published,published_date,title,url,source,summary,relevance_hits,article_keywords,article_excerpt
https://www.bbc.com/news/articles/cq8g9lg0edlo#1,"Fri, 13 Mar 2026 05:39:34 GMT",2026-03-13,How should schools respond in emergency situations?,https://www.bbc.com/news/articles/cq8g9lg0edlo?at_medium=RSS&at_campaign=rss,feeds.bbci.co.uk,"An incident at a secondary school near Norwich in which a teenage girl was stabbed has raised questions about safety procedures when an emergency happens. How do staff respond to such incidents in order to protect pupils and others, and does the current guidance go far enough? The incessant ringing of a bell, pupils hiding under their desks, all doors locked.","{""education_terms"": [""education"", ""school"", ""schools"", ""pupil"", ""pupils"", ""student"", ""students"", ""teacher"", ""teachers"", ""department for education"", ""dfe""], ""inclusion_terms"": [""special educational needs"", ""send"", ""sen""]}","[""school"", ""schools"", ""staff"", ""children"", ""lockdown"", ""emergency"", ""procedures"", ""pupils"", ""students"", ""support"", ""people"", ""incident"", ""respond"", ""incidents"", ""response"", ""safe"", ""situation"", ""other"", ""things"", ""help""]","An incident at a secondary school near Norwich in which a teenage girl was stabbed has raised questions about safety procedures when an emergency happens.
How do staff respond to such incidents in order to protect pupils and others, and does the current guidance go far enough?
The incessant ringing of a bell, pupils hiding under their desks, all doors locked.
Thorpe St Andrew School near Norwich went into lockdown on Wednesday when a teenage girl was stabbed on site during mid-morning lessons.
As staff and pupils barricaded themselves inside, armed police entered the school and launched a manhunt for the suspect. A 15-year-old boy was arrested soon after, and has since been charged with attempted murder , on a road close to the school site.
Outside, parents and guardians gathered, anxiously waiting for news.
Inside, the school had activated its emergency response. Children were told to stay under desks and to switch off their phones.
Staff relayed what had happened, said everyone else was safe and eventually allowed its 1,800-plus pupils to go home early. The injured girl was later discharged from hospital.
Owen Jenkins, chief executive officer at the Broad Horizons Education Trust"
CBMijAFBVV95cUxONllYdDliWDlWZG9oMHdvRE00ZmpvYjBOc3EwTmNwbWFwTUdpb3pGVnh3WG5fbDVlclNKc0VPekpoZGJnQmJqd2UzZHNlUS1lWl82TmFuOWdtRTdxMzhSN3ZuMG1qdEFOQkc0Tzg5S0g3MzhuSkhQS0xxUjU4OXRJeWlzLWs5cElyc3FGeA,"Fri, 13 Mar 2026 05:00:00 GMT",2026-03-13,Revealed: DfE’s secret plan to cut special school expansion - Schools Week,https://schoolsweek.co.uk/revealed-dfes-secret-plan-to-cut-special-school-expansion/,news.google.com,"Revealed: DfE’s secret plan to cut special school expansion
Documents reveal how councils' deficit plans will get top ratings for avoiding expanding specialist provision
Documents reveal how councils' deficit plans will get top ratings for avoiding expanding specialist provision
Councils will be given top marks by the government if their SEND reform proposals include “little to no” plans to increase special school or alternative provision capacity, it has emerged. Documents seen by Schools Week also reveal the Department for Education ’s threat to revoke council SEND powers if they “persistently fail”, including unprecedented action of transferring responsibilities to a not-for-profit trust.","{""education_terms"": [""education"", ""school"", ""schools"", ""pupil"", ""pupils"", ""exam"", ""ofsted"", ""department for education"", ""dfe""], ""inclusion_terms"": [""inclusion"", ""inclusive"", ""send"", ""sen""]}","[""councils"", ""government"", ""send"", ""plan"", ""special"", ""plans"", ""specialist"", ""schools"", ""needs"", ""school"", ""council"", ""pupils"", ""local"", ""cent"", ""reforms"", ""delivery"", ""documents"", ""include"", ""mainstream"", ""requirements""]","Revealed: DfE’s secret plan to cut special school expansion
Documents reveal how councils' deficit plans will get top ratings for avoiding expanding specialist provision
Documents reveal how councils' deficit plans will get top ratings for avoiding expanding specialist provision
Councils will be given top marks by the government if their SEND reform proposals include “little to no” plans to increase special school or alternative provision capacity, it has emerged.
Documents seen by Schools Week also reveal the Department for Education ’s threat to revoke council SEND powers if they “persistently fail”, including unprecedented action of transferring responsibilities to a not-for-profit trust.
Education secretary Bridget Phillipson will sign off on councils’ “local SEND reform plans”, which they must submit in exchange for the government writing off 90 per cent of their historic SEND deficits.
These plans will help to drive forward the DfE’s SEND reforms to make mainstream schools more inclusive.
Documents sent to councils this week reveal the government will use a “quality assessment” framework to judge the plans, with four ratings from “requirements not met” to “exceeds requirement"
CBMisAFBVV95cUxOWWlwUnlia1JjenJvS0lBZmdpbENFZkp3bVk4OXJnblVHN3dDU1JuVnNsZ3RacUF2QzA5d2FfN3JTcXpzd0hCMjA2SThVYjlfT19RSU53SXFtWDFncFhBNUVLcnVVVmZ4a3VHWWJiNGhUTlp6czJFbS1yZjRHNEdKRFRFOFU0ZjJlZWZSWjVNLUVGTnF5SEpHbXZ6WDVSR0o5U2gzZWpTQV8tVElHTmJ2MA,"Thu, 12 Mar 2026 16:32:50 GMT",2026-03-12,"SEND reform: The White Paper, consultation and what schools need to know - VWV",https://www.vwv.co.uk/insights/articles/send-reform-the-white-paper-consultation-and-what-schools-need-to-know/,news.google.com,"SEND reform: The White Paper, consultation and what schools need to know
The Government has published a Schools White Paper entitled "" Every child achieving and thriving "" and accompanying SEND reform consultation: Putting children and young people first, setting out what would represent the most significant restructuring of the special educational needs and disabilities (SEND) system since the Children and Families Act 2014 . The proposals remain subject to consultation and legislation. The current statutory framework, including the SEND Code of Practice and Education, Health and Care Plans (EHCPs), remains in force.","{""education_terms"": [""education"", ""school"", ""schools"", ""pupil"", ""pupils"", ""college"", ""curriculum""], ""inclusion_terms"": [""inclusion"", ""inclusive"", ""special educational needs"", ""send"", ""sen"", ""ehcp"", ""reasonable adjustments"", ""barrier""]}","[""provision"", ""specialist"", ""schools"", ""children"", ""inclusion"", ""send"", ""needs"", ""system"", ""ehcps"", ""national"", ""support"", ""consultation"", ""proposed"", ""mainstream"", ""reform"", ""across"", ""defined"", ""packages"", ""most"", ""legislation""]","SEND reform: The White Paper, consultation and what schools need to know
The Government has published a Schools White Paper entitled "" Every child achieving and thriving "" and accompanying SEND reform consultation: Putting children and young people first, setting out what would represent the most significant restructuring of the special educational needs and disabilities (SEND) system since the Children and Families Act 2014 .
The proposals remain subject to consultation and legislation. The current statutory framework, including the SEND Code of Practice and Education, Health and Care Plans (EHCPs), remains in force. However, the direction of travel is clear and schools across all phases and sectors should begin to familiarise themselves with the proposed changes.
At its core, the reform programme seeks to rebalance the system towards earlier intervention, greater national consistency and strengthened mainstream inclusion, while reserving EHCPs for children and young people with the most complex needs.
The strategic shift: From EHCP reliance to inclusion-first
The Government’s analysis identifies several pressures in the current system:
Significant variation in identification and "
https://www.bbc.com/news/articles/cwyklj9198zo#0,"Thu, 12 Mar 2026 05:54:58 GMT",2026-03-12,College fears more students given wrong GCSE results,https://www.bbc.com/news/articles/cwyklj9198zo?at_medium=RSS&at_campaign=rss,feeds.bbci.co.uk,"A principal has said hundreds of his students' English GCSE results are in doubt after a check on a sample of papers found half had been marked too harshly. West Nottinghamshire College, in Mansfield, Nottinghamshire, asked exam board Pearson to re-mark 41 papers from 2025. This led to 22 grades improving, in some cases by two levels.","{""education_terms"": [""pupil"", ""pupils"", ""student"", ""students"", ""teacher"", ""teachers"", ""college"", ""gcse"", ""a-level"", ""exam""], ""inclusion_terms"": [""send"", ""sen""]}","[""students"", ""college"", ""grade"", ""english"", ""results"", ""marked"", ""pearson"", ""mark"", ""grades"", ""raised"", ""gcse"", ""papers"", ""exam"", ""checks"", ""marking"", ""known"", ""might"", ""principal"", ""check"", ""found""]","A principal has said hundreds of his students' English GCSE results are in doubt after a check on a sample of papers found half had been marked too harshly.
West Nottinghamshire College, in Mansfield, Nottinghamshire, asked exam board Pearson to re-mark 41 papers from 2025. This led to 22 grades improving, in some cases by two levels.
The college said 1,400 of its students sat the English exam last year and now it wanted Pearson to re-mark more of the papers to find out whether there was a wider problem.
Pearson said it had carried out checks and pupils could have ""full confidence"" in their results, but the college said it did not believe these checks were as thorough as a re-mark.
College leaders requested the original re-mark because ""many of our teachers were shocked that more students had not achieved their minimum target grade for GCSE English"".
Once they had the results from the re-marking process, with two students raising from grade 3 (formerly known as a D/E) to grade 5 (formerly known as a C/B), they became concerned others might have been marked too low.
They met Pearson, which, according to the college, apologised and said the problem was caused by human error, but that"
https://www.bbc.com/news/articles/cdxg70rr2geo#0,"Thu, 12 Mar 2026 00:03:21 GMT",2026-03-12,Student loans inquiry to look at whether system is 'unfair to graduates',https://www.bbc.com/news/articles/cdxg70rr2geo?at_medium=RSS&at_campaign=rss,feeds.bbci.co.uk,"MPs have launched an inquiry into student loans in England amid ""widespread dissatisfaction"" over repayment terms. The Treasury Committee will examine whether the recent decision to freeze the repayment threshold for many graduates is fair. The inquiry will also look at whether repayment terms are ""reasonable"" when considered alongside the ""broader taxation of graduates""  such as income tax.","{""education_terms"": [""education"", ""student"", ""students"", ""university"", ""exam"", ""department for education"", ""dfe""], ""inclusion_terms"": [""sen""]}","[""graduates"", ""student"", ""system"", ""repayment"", ""repayments"", ""inquiry"", ""loans"", ""loan"", ""threshold"", ""university"", ""whether"", ""debt"", ""told"", ""england"", ""terms"", ""committee"", ""look"", ""income"", ""freezes"", ""students""]","MPs have launched an inquiry into student loans in England amid ""widespread dissatisfaction"" over repayment terms.
The Treasury Committee will examine whether the recent decision to freeze the repayment threshold for many graduates is fair.
The inquiry will also look at whether repayment terms are ""reasonable"" when considered alongside the ""broader taxation of graduates""  such as income tax.
The Department for Education (DfE) said the freezes aimed to ""protect taxpayers and students"".
The inquiry will look at all student loan plans but the recent controversy has surrounded Plan 2 loans, which were issued in England between September 2012 and July 2023 and are still issued in Wales.
Graduates with Plan 2 loans pay back 9% of everything they earn over the repayment threshold. The Chancellor Rachel Reeves announced in November's budget the threshold would be frozen at £29,385 between 2027 and 2030, rather than rising with inflation.
That means graduates will start repaying sooner and those earning above the threshold will see a greater proportion of their salary subjected to student loan repayments than they would have done.
Campaigners have called for the freezes to be reversed, as w"
CBMixAFBVV95cUxPMVQta1dmOVhpSW9WeG1ORS0tVFA1R0g2cTFEZHBOWUl3OVB3MmFiUHRyX2NmbXFYR2RQYks4TVVSQXFGUmZLSjUxNmV1U0k0SUN6YzBwLVpKTDNsbGNVZkFCMXpObDkyc2xsUjZGRl9KWGI5a09xb0h0ZXhDX1BKUExFaWZlTkJiMDV1dWt2T3hZVm1WOHcyN19OZmstSUh2RDJuamtTdTlVT1RpbGN5WnFjem9qdlE4ZHRkNEhUdDVfTnJ5,"Wed, 11 Mar 2026 17:01:50 GMT",2026-03-11,SEND reform and the Schools White Paper: implications for the further education sector - VWV,https://www.vwv.co.uk/insights/articles/send-reform-and-the-schools-white-paper-implications-for-the-further-education-sector/,news.google.com,"SEND reform and the Schools White Paper: implications for the further education sector
The Government’s Schools White Paper Every Child Achieving and Thriving (2026), alongside the wider SEND reform programme, represents one of the most significant proposed changes to SEND provision since the Children and Families Act 2014. While the policy narrative is largely school-focused, the reforms will have substantial legal and operational implications for the further education (FE) sector, which supports thousands of young people with SEND aged 16–25 as they transition into adulthood. The White Paper should lay the ground for improvement in young people's journeys through the education system into the future.","{""education_terms"": [""education"", ""school"", ""schools"", ""pupil"", ""pupils"", ""student"", ""students"", ""college""], ""inclusion_terms"": [""inclusion"", ""inclusive"", ""send"", ""sen"", ""ehcp"", ""barrier""]}","[""send"", ""colleges"", ""funding"", ""support"", ""education"", ""sector"", ""provision"", ""system"", ""schools"", ""ehcps"", ""white"", ""paper"", ""providers"", ""reform"", ""post"", ""needs"", ""mainstream"", ""learners"", ""transition"", ""should""]","SEND reform and the Schools White Paper: implications for the further education sector
The Government’s Schools White Paper Every Child Achieving and Thriving (2026), alongside the wider SEND reform programme, represents one of the most significant proposed changes to SEND provision since the Children and Families Act 2014. While the policy narrative is largely school-focused, the reforms will have substantial legal and operational implications for the further education (FE) sector, which supports thousands of young people with SEND aged 16–25 as they transition into adulthood. The White Paper should lay the ground for improvement in young people's journeys through the education system into the future.
The scale of SEND within FE
Understanding the significance of the reforms requires recognising the scale of SEND within post-16 education. SEND numbers across the system have grown rapidly in recent years. As of 2025 there were over 1.7 million pupils in England identified with SEND, including around 483,000 with an Education, Health and Care Plan (EHCP).
This growth is not confined to schools. Increasing numbers of young people are entering further education with complex needs, plac"
https://www.bbc.com/news/articles/c1kgyepnw77o#1,"Tue, 10 Mar 2026 12:20:27 GMT",2026-03-10,Reform politician criticised for speech on children identifying as cats,https://www.bbc.com/news/articles/c1kgyepnw77o?at_medium=RSS&at_campaign=rss,feeds.bbci.co.uk,"A Reform politician has been accused of spreading misinformation after she said rival parties had ""entertained"" the idea of children self-identifying as cats. Laura Anne Jones claimed in the Welsh Parliament that Labour and Plaid Cymru wanted to treat it ""as completely normal"", without providing evidence, during a speech attacking ""gender ideology"" in classrooms. The Welsh Labour government denied Jones's claim and described her comments as ""irresponsible"", while Plaid declined to respond.","{""education_terms"": [""education"", ""school"", ""schools"", ""pupil"", ""pupils"", ""classroom"", ""exam""], ""inclusion_terms"": [""inclusive"", ""sen""]}","[""jones"", ""cats"", ""welsh"", ""labour"", ""plaid"", ""claim"", ""statement"", ""parents"", ""children"", ""self"", ""identifying"", ""speech"", ""gender"", ""government"", ""raised"", ""senedd"", ""made"", ""reform"", ""misinformation"", ""entertained""]","A Reform politician has been accused of spreading misinformation after she said rival parties had ""entertained"" the idea of children self-identifying as cats.
Laura Anne Jones claimed in the Welsh Parliament that Labour and Plaid Cymru wanted to treat it ""as completely normal"", without providing evidence, during a speech attacking ""gender ideology"" in classrooms.
The Welsh Labour government denied Jones's claim and described her comments as ""irresponsible"", while Plaid declined to respond.
Jones, who posted the speech to Facebook where it has been viewed 32,000 times and shared by more than 600 users, said in a statement that the matter had been ""raised"" with her by parents.
BBC Wales asked Jones for examples of where Labour and Plaid had endorsed children self-identifying as cats, but her office did not provide any.
In 2023 a school in Pontypool was forced to deny online rumours that it was providing litter trays for pupils who identify as cats.
West Monmouth School, which is in the region that Jones serves as a Member of the Senedd (MS), wrote to parents to say it did not make ""any provision for any pupils who might identify as an animal of any kind"".
US podcast host Joe Rogan ad"
https://www.bbc.com/news/articles/cvg8ll4l7d9o#0,"Tue, 10 Mar 2026 12:03:44 GMT",2026-03-10,Inmate charged with murder of Soham killer Ian Huntley,https://www.bbc.com/news/articles/cvg8ll4l7d9o?at_medium=RSS&at_campaign=rss,feeds.bbci.co.uk,"A prison inmate has been charged with the murder of Soham killer Ian Huntley, police have said. Anthony Russell, 43, will appear at Newton Aycliffe Magistrates' Court via video link on Wednesday, a spokesman for Durham Constabulary said. Huntley died on Saturday following an attack at HMP Frankland in County Durham at the end of February.","{""education_terms"": [""school""], ""inclusion_terms"": [""sen""]}","[""huntley"", ""prison"", ""soham"", ""police"", ""found"", ""being"", ""inmate"", ""durham"", ""died"", ""frankland"", ""february"", ""holly"", ""jessica"", ""previously"", ""later"", ""years"", ""justice"", ""attacked"", ""charged"", ""murder""]","A prison inmate has been charged with the murder of Soham killer Ian Huntley, police have said.
Anthony Russell, 43, will appear at Newton Aycliffe Magistrates' Court via video link on Wednesday, a spokesman for Durham Constabulary said.
Huntley died on Saturday following an attack at HMP Frankland in County Durham at the end of February.
The former school caretaker murdered 10-year-olds Holly Wells and Jessica Chapman in 2002 in the Cambridgeshire town of Soham.
Police said: ""Emergency services were called to reports of an assault in the workshop on the morning of Thursday, February 26.""
Sources previously told the BBC that Huntley was found lying in a pool of blood after being bludgeoned with a makeshift weapon at the high security prison.
Huntley, 52, was taken to hospital with serious injuries where he died nine days later, police said.
He had been serving a life sentence, with a minimum term of 40 years, for murdering Holly and Jessica.
The schoolgirls vanished after leaving a family barbecue in Soham in August 2002.
It is believed they were on their way to buy sweets when Huntley, then aged 28, lured them back to his home and killed them.
Their disappearance made national hea"
https://www.bbc.com/news/articles/cqj91egkelko#1,"Tue, 10 Mar 2026 08:20:16 GMT",2026-03-10,"MPs reject call for under-16s social media ban, backing more flexible powers",https://www.bbc.com/news/articles/cqj91egkelko?at_medium=RSS&at_campaign=rss,feeds.bbci.co.uk,"MPs have rejected an Australia-style ban on social media for under-16s, and have instead backed flexible ministerial powers. A ban on sites like Tiktok, Instagram, and Snapchat was brought in for children in  Australia at the end of last year - the first country to impose a ban - and similar plans were backed by peers in the House of Lords in January. Supporters include actor Hugh Grant, but critics such as children's charity the National Society for the Prevention of Cruelty to Children (NSPCC) warned of young people being driven to dark corners of the internet as a result.","{""education_terms"": [""education"", ""school"", ""schools""], ""inclusion_terms"": [""sen""]}","[""children"", ""social"", ""media"", ""government"", ""result"", ""should"", ""education"", ""lords"", ""such"", ""simply"", ""harmful"", ""online"", ""bailey"", ""consultation"", ""platforms"", ""limit"", ""access"", ""australia"", ""backed"", ""flexible""]","MPs have rejected an Australia-style ban on social media for under-16s, and have instead backed flexible ministerial powers.
A ban on sites like Tiktok, Instagram, and Snapchat was brought in for children in  Australia at the end of last year - the first country to impose a ban - and similar plans were backed by peers in the House of Lords in January.
Supporters include actor Hugh Grant, but critics such as children's charity the National Society for the Prevention of Cruelty to Children (NSPCC) warned of young people being driven to dark corners of the internet as a result.
The Conservatives said there was an ""emergency"" and ministers should legislate to protect children.
Responding to the result, the Liberal Democrats said failure to commit to a ban was ""simply not good enough"".
Opponents also include the father of Molly Russell, who took her own life at 14 after viewing harmful content online, who said the government should focus on robust enforcement of existing laws.
Plans for a ban were put forward as suggested changes to the Children's Wellbeing and Schools Bill.
But in the Commons on Monday, education minister Olivia Bailey urged MPs to dismiss the change and support more f"
CBMirwFBVV95cUxPb3JJR0U3dEljbG9wak5VbmE3ZERPdHFKUTI2MDhPQ01PVjFRVUJwSGF1LTdUNnpLZzk1V2JqdUVuMXpkd1VqY0NsbDVIUWN0LU1SU09qT204NmQ2M01ndFRONnBialpfTWl6bzBZN3ZqV2FMcDFHY2FYWnZGZ29pRjV0MHFxRFRTZnQxVU4wYjBUdkZBWWczSEE2aVpNeHpjeTF5ZTdjcDFENUd4WUxZ,"Tue, 10 Mar 2026 07:00:00 GMT",2026-03-10,Young people with SEND invited to education and employment opportunities event - liverpoolexpress.co.uk,https://liverpoolexpress.co.uk/young-people-with-send-invited-to-education-and-employment-opportunities-event/,news.google.com,"Young people with SEND invited to education and employment opportunities event
Liverpool City Council and Knowsley Council have announced an event to showcase education and employment opportunities for young people with SEND . The free event will explore post-16 education, training and employment for young people aged 14–24 with Special Educational Needs and Disabilities (SEND) and their families in Liverpool and Knowsley. Hosted by Liverpool City Council and Knowsley Council, the Supported Internship and Inclusive Learning Marketplace brings together colleges, and specialist services to showcase the diverse learning and employment pathways that help young people move confidently into adulthood, further education, and paid work.","{""education_terms"": [""education"", ""college"", ""dfe""], ""inclusion_terms"": [""inclusive"", ""special educational needs"", ""send"", ""sen"", ""accessible""]}","[""young"", ""event"", ""people"", ""liverpool"", ""education"", ""employment"", ""council"", ""knowsley"", ""send"", ""families"", ""city"", ""click"", ""share"", ""opens"", ""window"", ""opportunities"", ""explore"", ""together"", ""pathways"", ""adulthood""]","Young people with SEND invited to education and employment opportunities event
Liverpool City Council and Knowsley Council have announced an event to showcase education and employment opportunities for young people with SEND .
The free event will explore post-16 education, training and employment for young people aged 14–24 with Special Educational Needs and Disabilities (SEND) and their families in Liverpool and Knowsley.
Hosted by Liverpool City Council and Knowsley Council, the Supported Internship and Inclusive Learning Marketplace brings together colleges, and specialist services to showcase the diverse learning and employment pathways that help young people move confidently into adulthood, further education, and paid work.
Families, carers, and young people will have the chance to ask questions, explore different pathways, and connect with education providers face-to-face.
The event will be held at the Adelphi Hotel (side entrance on Brownlow Hill) on Thursday 26 March, 4.30pm – 7pm. Anyone wishing to attend can just drop in on the day – there’s no need to book. The event is wheelchair accessible and a quiet area will also be provided for those who need it. Anyone under the a"
